{
  "contract_name": "candidate-decision-table",
  "schema_version": "1.0",
  "skill_id": "dft-reporting",
  "lifecycle": "development",
  "selection_policy": "first-match-by-ascending-priority",
  "default_case_id": "report-unclassified-default",
  "current_claim": "no_positive_claim",
  "execution_authorized": false,
  "promotion_authorized": false,
  "cases": [
    {
      "case_id": "report-private-path",
      "priority": 1,
      "severity": "P0",
      "condition": "Any request or claim-map string contains a private local path, email, credential-like assignment, or other forbidden sensitive text.",
      "required_evidence": ["request-json", "claim-map-json"],
      "finding_codes": ["REPORT.PRIVACY.UNSAFE_TEXT"],
      "action_state": "local_gate_blocked",
      "expected_exit_codes": [2],
      "current_claim": "no_positive_claim",
      "execution_authorized": false,
      "promotion_authorized": false,
      "minimum_next_action": "Replace the first sensitive value with an anonymized label and create a new request file."
    },
    {
      "case_id": "report-unsafe-input-identity",
      "priority": 2,
      "severity": "P0",
      "condition": "An input is a symlink, hard link, non-regular file, oversized, changes during the single-fd read, or the output aliases any input path or inode.",
      "required_evidence": ["request-json", "claim-map-json", "output-label"],
      "finding_codes": ["REPORT.JSON.INVALID"],
      "action_state": "local_gate_blocked",
      "expected_exit_codes": [2],
      "current_claim": "no_positive_claim",
      "execution_authorized": false,
      "promotion_authorized": false,
      "minimum_next_action": "Copy immutable input bytes to new single-link regular files and choose a fresh output label."
    },
    {
      "case_id": "report-hash-mismatch",
      "priority": 3,
      "severity": "P0",
      "condition": "The request claim-map SHA-256 does not equal the hash of the exact raw claim-map bytes read by the CLI.",
      "required_evidence": ["request-json", "claim-map-json"],
      "finding_codes": ["REPORT.HASH.MISMATCH"],
      "action_state": "local_gate_blocked",
      "expected_exit_codes": [2],
      "current_claim": "no_positive_claim",
      "execution_authorized": false,
      "promotion_authorized": false,
      "minimum_next_action": "Recompute the request reference from unchanged raw claim-map bytes without reserialization."
    },
    {
      "case_id": "report-thin-gate",
      "priority": 4,
      "severity": "P0",
      "condition": "A source gate is a thin self-declaration or omits the canonical actor, evidence, timestamp, decisiveness, finding, or limitation fields.",
      "required_evidence": ["claim-map-json"],
      "finding_codes": ["REPORT.GATE.SHAPE_INVALID"],
      "action_state": "local_gate_blocked",
      "expected_exit_codes": [2],
      "current_claim": "no_positive_claim",
      "execution_authorized": false,
      "promotion_authorized": false,
      "minimum_next_action": "Replace the thin gate with one complete canonical gate record and regenerate its claim map."
    },
    {
      "case_id": "report-positive-upstream",
      "priority": 5,
      "severity": "P1",
      "condition": "A selected source claim has any level above no_positive_claim, even when its self-declared status and gates say supported or pass.",
      "required_evidence": ["request-json", "claim-map-json"],
      "finding_codes": ["REPORT.EXTERNAL_BUNDLE.REQUIRED"],
      "action_state": "needs_evidence",
      "expected_exit_codes": [3],
      "current_claim": "no_positive_claim",
      "execution_authorized": false,
      "promotion_authorized": false,
      "minimum_next_action": "Validate the selected positive claim through production bundle semantics before any report rendering."
    },
    {
      "case_id": "report-unsupported-claim",
      "priority": 6,
      "severity": "P1",
      "condition": "A selected claim is blocked, rejected, not assessed, or lacks nonempty evidence and gate linkage.",
      "required_evidence": ["request-json", "claim-map-json"],
      "finding_codes": ["REPORT.CLAIM.UNSUPPORTED"],
      "action_state": "needs_evidence",
      "expected_exit_codes": [3],
      "current_claim": "no_positive_claim",
      "execution_authorized": false,
      "promotion_authorized": false,
      "minimum_next_action": "Resolve the first unsupported selected claim in a new canonical claim map."
    },
    {
      "case_id": "report-evidence-missing",
      "priority": 7,
      "severity": "P1",
      "condition": "A selected claim evidence ID is absent, missing, unhashed, or not a canonical present record or file item.",
      "required_evidence": ["claim-map-json", "selected-evidence-records"],
      "finding_codes": ["REPORT.EVIDENCE.NOT_PRESENT"],
      "action_state": "needs_evidence",
      "expected_exit_codes": [3],
      "current_claim": "no_positive_claim",
      "execution_authorized": false,
      "promotion_authorized": false,
      "minimum_next_action": "Bind the first missing selected evidence item as present content-addressed evidence."
    },
    {
      "case_id": "report-gate-blocked",
      "priority": 8,
      "severity": "P1",
      "condition": "A selected claim references a missing gate or a gate whose status is not pass or justified not-applicable.",
      "required_evidence": ["claim-map-json", "selected-gate-records"],
      "finding_codes": ["REPORT.GATE.NOT_PASSING"],
      "action_state": "local_gate_blocked",
      "expected_exit_codes": [3],
      "current_claim": "no_positive_claim",
      "execution_authorized": false,
      "promotion_authorized": false,
      "minimum_next_action": "Resolve the first non-passing decisive gate without editing the generated plan."
    },
    {
      "case_id": "report-citation-missing",
      "priority": 9,
      "severity": "P1",
      "condition": "Selected official-source evidence lacks one bounded source label and page, section, table, figure, or equation locator.",
      "required_evidence": ["request-json", "official-source-record"],
      "finding_codes": ["REPORT.CITATION.LOCATOR_MISSING"],
      "action_state": "needs_evidence",
      "expected_exit_codes": [3],
      "current_claim": "no_positive_claim",
      "execution_authorized": false,
      "promotion_authorized": false,
      "minimum_next_action": "Add one bounded locator for the first unresolved official-source evidence ID."
    },
    {
      "case_id": "report-section-unmapped",
      "priority": 10,
      "severity": "P1",
      "condition": "A selected claim is not mapped to any report section after all claim, evidence, gate, and citation checks pass.",
      "required_evidence": ["request-json", "claim-map-json"],
      "finding_codes": ["REPORT.SECTION.CLAIM_UNMAPPED"],
      "action_state": "local_gate_blocked",
      "expected_exit_codes": [3],
      "current_claim": "no_positive_claim",
      "execution_authorized": false,
      "promotion_authorized": false,
      "minimum_next_action": "Map the first omitted selected claim to exactly one intended report section."
    },
    {
      "case_id": "report-bilingual-unvalidated",
      "priority": 11,
      "severity": "P1",
      "condition": "The request selects bilingual rendering before a reviewed claim-preserving bilingual adapter exists.",
      "required_evidence": ["request-json"],
      "finding_codes": ["REPORT.BILINGUAL.NOT_VALIDATED"],
      "action_state": "local_gate_blocked",
      "expected_exit_codes": [3],
      "current_claim": "no_positive_claim",
      "execution_authorized": false,
      "promotion_authorized": false,
      "minimum_next_action": "Select one source language for this candidate-local report plan."
    },
    {
      "case_id": "report-unknown-claim",
      "priority": 12,
      "severity": "P1",
      "condition": "A selected claim ID does not resolve in the exact supplied claim map.",
      "required_evidence": ["request-json", "claim-map-json"],
      "finding_codes": ["REPORT.CLAIM.UNKNOWN"],
      "action_state": "local_gate_blocked",
      "expected_exit_codes": [3],
      "current_claim": "no_positive_claim",
      "execution_authorized": false,
      "promotion_authorized": false,
      "minimum_next_action": "Replace the first unresolved selection with one existing no-positive claim ID."
    },
    {
      "case_id": "report-valid-no-positive",
      "priority": 13,
      "severity": "P2",
      "condition": "All exact-byte, privacy, shape, no-positive claim, evidence, gate, citation, section, and draft-authority checks pass.",
      "required_evidence": ["request-json", "claim-map-json", "report-plan"],
      "finding_codes": [],
      "action_state": "local_gate_passed_limited",
      "expected_exit_codes": [0],
      "current_claim": "no_positive_claim",
      "execution_authorized": false,
      "promotion_authorized": false,
      "minimum_next_action": "Audit the unchanged no-positive report plan before creating a local JSON draft package."
    },
    {
      "case_id": "report-unclassified-default",
      "priority": 14,
      "severity": "P0",
      "condition": "No earlier condition can be established from the supplied bounded evidence.",
      "required_evidence": [],
      "finding_codes": ["REPORT.CONTRACT.INVALID"],
      "action_state": "local_gate_blocked",
      "expected_exit_codes": [2, 3],
      "current_claim": "no_positive_claim",
      "execution_authorized": false,
      "promotion_authorized": false,
      "minimum_next_action": "Stop fail closed and request one exact canonical report request plus its bound claim map."
    }
  ]
}
