{
  "contract_name": "candidate-decision-table",
  "schema_version": "1.0",
  "skill_id": "gpumd-rigorous-simulations",
  "lifecycle": "development",
  "selection_policy": "first-match-by-ascending-priority",
  "default_case_id": "gpu-default-fail-closed",
  "current_claim": "no_positive_claim",
  "execution_authorized": false,
  "promotion_authorized": false,
  "cases": [
    {
      "case_id": "gpu-version-evidence-mismatch",
      "priority": 1,
      "severity": "P0",
      "condition": "The release, commit, or official documentation does not exactly match GPUMD v5.3.",
      "required_evidence": ["version-banner", "official-v5.3-source-record"],
      "finding_codes": ["GPUMD.VERSION.UNSUPPORTED"],
      "action_state": "needs_evidence",
      "expected_exit_codes": [3],
      "current_claim": "no_positive_claim",
      "execution_authorized": false,
      "promotion_authorized": false,
      "minimum_next_action": "Pin the exact v5.3 tag, commit, banner, and bundled primary documentation."
    },
    {
      "case_id": "gpu-known-phonon-version-defect",
      "priority": 2,
      "severity": "P0",
      "condition": "A compute_phonon result is traced to GPUMD 5.1 or 5.2.",
      "required_evidence": ["version-banner", "phonon-method-record"],
      "finding_codes": ["GPUMD.VERSION.UNSUPPORTED"],
      "action_state": "local_gate_blocked",
      "expected_exit_codes": [2],
      "current_claim": "no_positive_claim",
      "execution_authorized": false,
      "promotion_authorized": false,
      "minimum_next_action": "Exclude the affected result and regenerate it only under a separately verified corrected version."
    },
    {
      "case_id": "gpu-unit-or-boundary-mismatch",
      "priority": 3,
      "severity": "P0",
      "condition": "Fixed units, pbc, Lattice, or Properties mappings are missing or inconsistent.",
      "required_evidence": ["plan-report", "model.xyz"],
      "finding_codes": ["GPUMD.UNITS.MISMATCH", "GPUMD.BOUNDARY.MISMATCH"],
      "action_state": "local_gate_blocked",
      "expected_exit_codes": [2],
      "current_claim": "no_positive_claim",
      "execution_authorized": false,
      "promotion_authorized": false,
      "minimum_next_action": "Align the exact GPUMD unit map and all three extxyz boundary and cell declarations."
    },
    {
      "case_id": "gpu-potential-provenance-unresolved",
      "priority": 4,
      "severity": "P0",
      "condition": "Potential identity, hash, source, element map, compatibility, or independent license status is unresolved.",
      "required_evidence": ["potential-file", "model-provenance"],
      "finding_codes": ["GPUMD.POTENTIAL.PROVENANCE", "GPUMD.LICENSE.UNRESOLVED"],
      "action_state": "needs_evidence",
      "expected_exit_codes": [2, 3],
      "current_claim": "no_positive_claim",
      "execution_authorized": false,
      "promotion_authorized": false,
      "minimum_next_action": "Bind the exact potential bytes, element map, source, compatibility evidence, and independent terms."
    },
    {
      "case_id": "gpu-minimum-image-failed",
      "priority": 5,
      "severity": "P0",
      "condition": "A non-NEP periodic cell thickness is not greater than twice the potential cutoff.",
      "required_evidence": ["input-audit"],
      "finding_codes": ["GPUMD.POTENTIAL.MINIMUM_IMAGE"],
      "action_state": "local_gate_blocked",
      "expected_exit_codes": [2],
      "current_claim": "no_positive_claim",
      "execution_authorized": false,
      "promotion_authorized": false,
      "minimum_next_action": "Enlarge the periodic cell or adopt a separately justified compatible interaction model."
    },
    {
      "case_id": "gpu-initial-state-or-seed-invalid",
      "priority": 6,
      "severity": "P0",
      "condition": "New velocities rely on an omitted or conflicting seed, or a continuation does not preserve the declared state velocities.",
      "required_evidence": ["plan-report", "run.in", "model.xyz"],
      "finding_codes": ["GPUMD.SEED.POLICY", "GPUMD.RESTART.LINEAGE"],
      "action_state": "local_gate_blocked",
      "expected_exit_codes": [2],
      "current_claim": "no_positive_claim",
      "execution_authorized": false,
      "promotion_authorized": false,
      "minimum_next_action": "Choose one explicit initial-state route and bind the exact seed or state-file lineage."
    },
    {
      "case_id": "gpu-nonpropagating-controls-missing",
      "priority": 7,
      "severity": "P0",
      "condition": "Ensemble, dump_thermo, dump_restart, or dump_xyz is not repeated before each run block.",
      "required_evidence": ["run.in", "input-audit"],
      "finding_codes": ["GPUMD.RUN_BLOCK.NONPROPAGATING"],
      "action_state": "local_gate_blocked",
      "expected_exit_codes": [2],
      "current_claim": "no_positive_claim",
      "execution_authorized": false,
      "promotion_authorized": false,
      "minimum_next_action": "Repeat every non-propagating control with the planned values before each run block."
    },
    {
      "case_id": "gpu-restart-exactness-unproved",
      "priority": 8,
      "severity": "P1",
      "condition": "A restart.xyz file is presented as exact integrator or thermostat and barostat continuation.",
      "required_evidence": ["plan-report", "state-file"],
      "finding_codes": ["GPUMD.RESTART.LINEAGE"],
      "action_state": "needs_evidence",
      "expected_exit_codes": [3],
      "current_claim": "no_positive_claim",
      "execution_authorized": false,
      "promotion_authorized": false,
      "minimum_next_action": "Bind the state file and limit continuation claims to version-matched documented recoverability."
    },
    {
      "case_id": "gpu-output-integrity-failed",
      "priority": 9,
      "severity": "P0",
      "condition": "Stdout completion markers are missing or duplicated, or thermo rows are malformed, non-finite, or count-mismatched.",
      "required_evidence": ["stdout", "thermo.out"],
      "finding_codes": ["GPUMD.OUTPUT.COMPLETION", "GPUMD.OUTPUT.NONFINITE"],
      "action_state": "local_gate_blocked",
      "expected_exit_codes": [2],
      "current_claim": "no_positive_claim",
      "execution_authorized": false,
      "promotion_authorized": false,
      "minimum_next_action": "Provide one exact clean output segment and diagnose the first completion or thermo mismatch."
    },
    {
      "case_id": "gpu-statistical-acceptance-failed",
      "priority": 10,
      "severity": "P1",
      "condition": "Effective sample count or block-mean uncertainty misses a predeclared bound.",
      "required_evidence": ["output-audit"],
      "finding_codes": ["GPUMD.STATISTICS.LOW_ESS", "GPUMD.STATISTICS.UNCERTAINTY"],
      "action_state": "local_gate_blocked",
      "expected_exit_codes": [2],
      "current_claim": "no_positive_claim",
      "execution_authorized": false,
      "promotion_authorized": false,
      "minimum_next_action": "Extend or replicate the unchanged predeclared production protocol and re-evaluate the same estimator."
    },
    {
      "case_id": "gpu-trajectory-lineage-failed",
      "priority": 11,
      "severity": "P1",
      "condition": "Trajectory Time, pbc, Lattice, Properties, site order, cadence, or raw upstream lineage is inconsistent.",
      "required_evidence": ["trajectory.xyz", "input-audit", "output-audit"],
      "finding_codes": ["GPUMD.TRAJECTORY.CADENCE", "GPUMD.UPSTREAM.MISMATCH"],
      "action_state": "local_gate_blocked",
      "expected_exit_codes": [2, 3],
      "current_claim": "no_positive_claim",
      "execution_authorized": false,
      "promotion_authorized": false,
      "minimum_next_action": "Restore one exact raw-byte-bound trajectory segment with stable site order and documented cadence."
    },
    {
      "case_id": "gpu-default-fail-closed",
      "priority": 12,
      "severity": "P0",
      "condition": "No earlier condition can be established from exact evidence, or execution, installation, scheduling, or resource control is requested.",
      "required_evidence": [],
      "finding_codes": ["GPUMD.EXECUTION.NOT_AUTHORIZED"],
      "action_state": "local_gate_blocked",
      "expected_exit_codes": [2],
      "current_claim": "no_positive_claim",
      "execution_authorized": false,
      "promotion_authorized": false,
      "minimum_next_action": "Stop fail closed and obtain separately authenticated evidence and exact-scope execution authorization."
    }
  ]
}
