{
  "contract_name": "candidate-decision-table",
  "schema_version": "1.0",
  "skill_id": "lobster-bonding-analysis",
  "lifecycle": "development",
  "selection_policy": "first-match-by-ascending-priority",
  "default_case_id": "lob-dt-default-fail-closed",
  "current_claim": "no_positive_claim",
  "execution_authorized": false,
  "promotion_authorized": false,
  "cases": [
    {
      "case_id": "lob-dt-001",
      "priority": 1,
      "severity": "P1",
      "condition": "Exact 5.1.1 synthetic profile, independent parent receipt, and all selected hash-bound task artifacts pass every local gate.",
      "required_evidence": ["provider-profile", "parent-validation-receipt", "task-artifacts"],
      "finding_codes": [],
      "action_state": "local_gate_passed_limited",
      "expected_exit_codes": [0],
      "current_claim": "no_positive_claim",
      "execution_authorized": false,
      "promotion_authorized": false,
      "minimum_next_action": "Retain the synthetic report and obtain legal real-artifact evidence before any promotion review."
    },
    {
      "case_id": "lob-dt-002",
      "priority": 2,
      "severity": "P1",
      "condition": "Provider version or environment profile differs from the only pinned profile.",
      "required_evidence": ["provider-profile", "version-evidence"],
      "finding_codes": ["LOB.PROVIDER.VERSION_UNSUPPORTED"],
      "action_state": "needs_evidence",
      "expected_exit_codes": [3],
      "current_claim": "no_positive_claim",
      "execution_authorized": false,
      "promotion_authorized": false,
      "minimum_next_action": "Create and forward-validate a separate exact-version profile."
    },
    {
      "case_id": "lob-dt-003",
      "priority": 3,
      "severity": "P0",
      "condition": "Declared parent SHA-256 differs from the exact bytes read by the auditor.",
      "required_evidence": ["parent-record", "parent-record-sha256"],
      "finding_codes": ["LOB.PARENT.HASH_MISMATCH"],
      "action_state": "local_gate_blocked",
      "expected_exit_codes": [5],
      "current_claim": "no_positive_claim",
      "execution_authorized": false,
      "promotion_authorized": false,
      "minimum_next_action": "Restore the immutable parent record or issue a reviewed lineage replacement."
    },
    {
      "case_id": "lob-dt-004",
      "priority": 4,
      "severity": "P0",
      "condition": "Parent gates self-report pass but no independently hash-bound validation receipt matches the current parent bytes.",
      "required_evidence": ["parent-record", "parent-validation-receipt"],
      "finding_codes": ["LOB.PARENT.VALIDATION_DETACHED"],
      "action_state": "needs_evidence",
      "expected_exit_codes": [5],
      "current_claim": "no_positive_claim",
      "execution_authorized": false,
      "promotion_authorized": false,
      "minimum_next_action": "Produce an independent validation receipt bound to the current parent and gate-evidence hashes."
    },
    {
      "case_id": "lob-dt-005",
      "priority": 5,
      "severity": "P0",
      "condition": "Structure, k-point, potential metadata, settings, protocol, or wavefunction identity differs across parent, declaration, and execution records.",
      "required_evidence": ["parent-record", "execution-identity", "dft-input-identities"],
      "finding_codes": ["LOB.PARENT.IDENTITY_MISMATCH"],
      "action_state": "local_gate_blocked",
      "expected_exit_codes": [5],
      "current_claim": "no_positive_claim",
      "execution_authorized": false,
      "promotion_authorized": false,
      "minimum_next_action": "Regenerate one atomic handoff from the exact DFT parent and execution records."
    },
    {
      "case_id": "lob-dt-006",
      "priority": 6,
      "severity": "P0",
      "condition": "A fatal marker is present or the exact-profile completion marker is absent.",
      "required_evidence": ["lobsterout-artifact", "completion-profile"],
      "finding_codes": ["LOB.COMPLETION.MARKER_MISSING"],
      "action_state": "local_gate_blocked",
      "expected_exit_codes": [5],
      "current_claim": "no_positive_claim",
      "execution_authorized": false,
      "promotion_authorized": false,
      "minimum_next_action": "Preserve the failed run, diagnose it, and provide a new complete artifact."
    },
    {
      "case_id": "lob-dt-007",
      "priority": 7,
      "severity": "P0",
      "condition": "Absolute charge or total spilling is absent, invalid, or exceeds the predeclared threshold.",
      "required_evidence": ["lobsterout-artifact", "projection-thresholds"],
      "finding_codes": ["LOB.PROJECTION.SPILLING_MISSING"],
      "action_state": "local_gate_blocked",
      "expected_exit_codes": [5],
      "current_claim": "no_positive_claim",
      "execution_authorized": false,
      "promotion_authorized": false,
      "minimum_next_action": "Reassess parent quality and basis choice without post-hoc threshold relaxation."
    },
    {
      "case_id": "lob-dt-008",
      "priority": 8,
      "severity": "P1",
      "condition": "Projected-band fraction, projection energy window, or projection Fermi evidence is incomplete.",
      "required_evidence": ["projection-population", "projection-window", "fermi-reference"],
      "finding_codes": ["LOB.PROJECTION.INCOMPLETE"],
      "action_state": "needs_evidence",
      "expected_exit_codes": [5],
      "current_claim": "no_positive_claim",
      "execution_authorized": false,
      "promotion_authorized": false,
      "minimum_next_action": "Supply projection-population and reference-window evidence before curve analysis."
    },
    {
      "case_id": "lob-dt-009",
      "priority": 9,
      "severity": "P0",
      "condition": "Curve sign, integral semantics, Fermi reference, or energy window is absent or detached from lobsterout evidence.",
      "required_evidence": ["curve-artifact", "curve-convention", "lobsterout-artifact"],
      "finding_codes": ["LOB.CURVE.FERMI_ALIGNMENT_FAILED"],
      "action_state": "local_gate_blocked",
      "expected_exit_codes": [4, 5],
      "current_claim": "no_positive_claim",
      "execution_authorized": false,
      "promotion_authorized": false,
      "minimum_next_action": "Re-export the curve with an explicit convention and matching projection reference."
    },
    {
      "case_id": "lob-dt-010",
      "priority": 10,
      "severity": "P0",
      "condition": "The request asks automation to conclude bond existence, order, strength, oxidation state, stability, or causality.",
      "required_evidence": ["requested-claims", "scientific-review-boundary"],
      "finding_codes": ["LOB.CLAIM.AUTOMATIC_CHEMICAL_INTERPRETATION_FORBIDDEN"],
      "action_state": "needs_authorization",
      "expected_exit_codes": [2],
      "current_claim": "no_positive_claim",
      "execution_authorized": false,
      "promotion_authorized": false,
      "minimum_next_action": "Limit automation to technical evidence and obtain an independent expert decision."
    },
    {
      "case_id": "lob-dt-default-fail-closed",
      "priority": 11,
      "severity": "P0",
      "condition": "No earlier condition can be established from exact bounded evidence.",
      "required_evidence": [],
      "finding_codes": ["LOB.INPUT.CONTRACT_INVALID"],
      "action_state": "local_gate_blocked",
      "expected_exit_codes": [2],
      "current_claim": "no_positive_claim",
      "execution_authorized": false,
      "promotion_authorized": false,
      "minimum_next_action": "Stop and obtain enough exact bounded evidence to select one earlier case deterministically."
    }
  ]
}
